<?xml version="1.0" encoding="UTF-8"?>
<dataroot xmlns:od="urn:schemas-microsoft-com:officedata" xmlns:xsi="http://www.w3.org/2001/XMLSchema-instance"  xsi:noNamespaceSchemaLocation="agent_abilities.xsd" generated="2007-01-29T16:55:54">
<agent_abilities>
<ability>command_land</ability>
<agent>admiral</agent>
<default_value>4</default_value>
</agent_abilities>
<agent_abilities>
<ability>command_land</ability>
<agent>bandit</agent>
<default_value>2</default_value>
</agent_abilities>
<agent_abilities>
<ability>command_land</ability>
<agent>captain</agent>
<default_value>1</default_value>
</agent_abilities>
<agent_abilities>
<ability>command_land</ability>
<agent>colonel</agent>
<default_value>3</default_value>
</agent_abilities>
<agent_abilities>
<ability>command_land</ability>
<agent>explorer</agent>
<default_value>1</default_value>
</agent_abilities>
<agent_abilities>
<ability>command_land</ability>
<agent>general</agent>
<default_value>5</default_value>
</agent_abilities>
<agent_abilities>
<ability>command_land</ability>
<agent>pirate</agent>
<default_value>1</default_value>
</agent_abilities>
<agent_abilities>
<ability>command_sea</ability>
<agent>admiral</agent>
<default_value>5</default_value>
</agent_abilities>
<agent_abilities>
<ability>command_sea</ability>
<agent>captain</agent>
<default_value>3</default_value>
</agent_abilities>
<agent_abilities>
<ability>command_sea</ability>
<agent>general</agent>
<default_value>1</default_value>
</agent_abilities>
<agent_abilities>
<ability>command_sea</ability>
<agent>pirate</agent>
<default_value>2</default_value>
</agent_abilities>
<agent_abilities>
<ability>convert</ability>
<agent>missionary</agent>
<default_value>1</default_value>
</agent_abilities>
<agent_abilities>
<ability>research</ability>
<agent>thinker</agent>
<default_value>2</default_value>
</agent_abilities>
<agent_abilities>
<ability>subterfuge</ability>
<agent>bandit</agent>
<default_value>2</default_value>
</agent_abilities>
<agent_abilities>
<ability>subterfuge</ability>
<agent>explorer</agent>
<default_value>2</default_value>
</agent_abilities>
<agent_abilities>
<ability>subterfuge</ability>
<agent>missionary</agent>
<default_value>1</default_value>
</agent_abilities>
<agent_abilities>
<ability>subterfuge</ability>
<agent>pirate</agent>
<default_value>2</default_value>
</agent_abilities>
<agent_abilities>
<ability>subterfuge</ability>
<agent>settler</agent>
<default_value>1</default_value>
</agent_abilities>
<agent_abilities>
<ability>subterfuge</ability>
<agent>spy</agent>
<default_value>4</default_value>
</agent_abilities>
<agent_abilities>
<ability>subterfuge</ability>
<agent>thinker</agent>
<default_value>1</default_value>
</agent_abilities>
</dataroot>
